{
  "$schema": "http://json-schema.org/draft-07/schema#",
  "title": "software-use private index",
  "type": "object",
  "required": ["version", "generated_at", "prefix", "count", "skills", "missing"],
  "properties": {
    "version": {"type": "string"},
    "generated_at": {"type": "string", "pattern": "^\\d{4}-\\d{2}-\\d{2}T\\d{2}:\\d{2}:\\d{2}$"},
    "prefix": {"type": "string", "const": "software_use_only-"},
    "count": {"type": "integer", "minimum": 0},
    "missing": {
      "type": "array",
      "items": {
        "type": "object",
        "required": ["name", "reason"],
        "properties": {
          "name": {"type": "string"},
          "reason": {"enum": ["E_NO_SKILL_MD", "E_BAD_SLUG", "E_NAME_MISMATCH", "E_VISIBILITY"]}
        }
      }
    },
    "skills": {
      "type": "array",
      "items": {
        "type": "object",
        "required": ["name", "app", "path", "title", "summary", "triggers", "tools",
                      "visibility", "confidence", "uses", "learned_from", "status"],
        "properties": {
          "name": {"type": "string", "pattern": "^software_use_only-[a-z0-9][a-z0-9._-]*$"},
          "app": {"type": "string", "pattern": "^[a-z0-9][a-z0-9._-]*$"},
          "path": {"type": "string"},
          "title": {"type": "string"},
          "version": {"type": "string"},
          "summary": {"type": "string"},
          "triggers": {"type": "array", "items": {"type": "string"}},
          "tools": {"type": "array", "items": {"type": "string"}},
          "visibility": {"type": "string", "const": "PRIVATE"},
          "parent": {"type": "string", "const": "software-use"},
          "confidence": {"type": "number", "minimum": 0, "maximum": 1},
          "uses": {"type": "integer", "minimum": 0},
          "last_used": {"type": ["string", "null"]},
          "learned_from": {"type": "array", "items": {"type": "string"}},
          "used_skills": {"type": "array", "items": {"type": "string"}},
          "evidence": {"type": "array", "items": {"type": "string"}},
          "status": {"enum": ["ready", "draft", "stale"]}
        }
      }
    }
  }
}
